{
  "agent_type": "writer",
  "allowed_actions": [
    "read_material_bundle",
    "draft_candidate_artifact",
    "return_evidence"
  ],
  "allowed_read_paths": [
    "examples/materials/evidence_inventory.v1.yaml",
    "examples/materials/claim_boundary_map.v2.yaml",
    "examples/materials/reader_spine.v1.yaml",
    "examples/materials/terminology_register.v1.yaml",
    "examples/materials/reference_sidecar.v1.yaml"
  ],
  "allowed_tools": [
    "none"
  ],
  "allowed_write_paths": [
    "runs/security-state-aware-mixed-platoon/phase10-readiness-dry-run/candidate-artifacts/S07.candidate-placeholder.json"
  ],
  "completion_forbidden": true,
  "evidence_anchors": [
    "examples/materials/evidence_inventory.v1.yaml",
    "examples/materials/claim_boundary_map.v2.yaml",
    "examples/materials/reader_spine.v1.yaml",
    "examples/materials/terminology_register.v1.yaml",
    "examples/materials/reference_sidecar.v1.yaml"
  ],
  "expected_output_schema": "ppg-material/v0.1",
  "failure_report_format": "MissingMaterialReport with run-owned candidate path, consumed material ids, validator evidence, and no source-repository writes",
  "forbidden_routes": [
    "mark_graph_complete",
    "dispatch_subagents",
    "write_outside_allowed_write_paths",
    "change_owner_intent"
  ],
  "ingestion_target": "runs/security-state-aware-mixed-platoon/phase10-readiness-dry-run/candidate-artifacts/S07.candidate-placeholder.json",
  "input_materials": [
    "evidence_inventory_v1",
    "claim_boundary_map_v2",
    "reader_spine_v1",
    "terminology_register_v1",
    "reference_sidecar_v1"
  ],
  "mandatory_controls": {
    "claim_boundary": "claim_boundary_map_v2",
    "evidence_inventory": "evidence_inventory_v1",
    "reader_spine": "reader_spine_v1",
    "reference_sidecar": "reference_sidecar_v1",
    "terminology_register": "terminology_register_v1"
  },
  "mission": "Produce terminology and paragraph-level surface controls for bounded writing.",
  "no_recursive_orchestration": true,
  "output_artifact_path": "runs/security-state-aware-mixed-platoon/phase10-readiness-dry-run/candidate-artifacts/S07.candidate-placeholder.json",
  "owner_gate_required": false,
  "packet_id": "phase10_s07_rhetoric_surface_control_packet_v1.phase10_run",
  "return_format": {
    "candidate_artifact": "required",
    "evidence": "required",
    "missing_material_report": "required_if_blocked",
    "remaining_risks": "required"
  },
  "schema_version": "ppg-task-packet/v0.1",
  "stage_contract_ref": "examples/stage-contracts/S07.stage-contract.json",
  "stage_id": "S07",
  "status": "planned",
  "stop_condition": "S07 candidate artifact written to the run-owned path only; return evidence without claiming graph, manuscript, or submission completion.",
  "target_material": "phase10_s07_surface_control",
  "task_kind": "rhetoric_surface_control",
  "validators": [
    "validate_packet:phase10_stage_binding",
    "content_validator:S07"
  ],
  "worker_boot_clause": "completion_forbidden; no_recursive_orchestration; allowed_write_paths; MissingMaterialReport required when materials are missing; return candidate/evidence only."
}
