{
  "agent_type": "critic",
  "allowed_actions": [
    "read_material_bundle",
    "draft_candidate_artifact",
    "return_evidence"
  ],
  "allowed_read_paths": [
    "examples/materials/evidence_inventory.v1.yaml",
    "examples/materials/claim_boundary_map.v2.yaml",
    "examples/materials/reader_spine.v1.yaml",
    "examples/materials/terminology_register.v1.yaml",
    "examples/materials/reference_sidecar.v1.yaml"
  ],
  "allowed_tools": [
    "none"
  ],
  "allowed_write_paths": [
    "runs/security-state-aware-mixed-platoon/phase12-formal-full-flow-runtime-test/candidate-artifacts/S03.candidate.json"
  ],
  "completion_forbidden": true,
  "evidence_anchors": [
    "examples/materials/evidence_inventory.v1.yaml",
    "examples/materials/claim_boundary_map.v2.yaml",
    "examples/materials/reader_spine.v1.yaml",
    "examples/materials/terminology_register.v1.yaml",
    "examples/materials/reference_sidecar.v1.yaml"
  ],
  "expected_output_schema": "ppg-material/v0.1",
  "failure_report_format": "MissingMaterialReport with run-owned candidate path, consumed material ids, validator evidence, and no source-repository writes",
  "forbidden_routes": [
    "mark_graph_complete",
    "dispatch_subagents",
    "write_outside_allowed_write_paths",
    "change_owner_intent"
  ],
  "ingestion_target": "runs/security-state-aware-mixed-platoon/phase12-formal-full-flow-runtime-test/candidate-artifacts/S03.candidate.json",
  "input_materials": [
    "evidence_inventory_v1",
    "claim_boundary_map_v2",
    "reader_spine_v1",
    "terminology_register_v1",
    "reference_sidecar_v1"
  ],
  "mandatory_controls": {
    "claim_boundary": "claim_boundary_map_v2",
    "evidence_inventory": "evidence_inventory_v1",
    "nature_overlay_packet_clauses": [
      "nature_overlay_ref:nature_expert_writing",
      "nature_stage_binding:S03",
      "nature_overlay_role:support"
    ],
    "nature_overlay_ref": "runtime/stage_overlay_registry.json#nature_expert_writing",
    "nature_overlay_stage_binding": "S03",
    "reader_spine": "reader_spine_v1",
    "reference_sidecar": "reference_sidecar_v1",
    "terminology_register": "terminology_register_v1"
  },
  "mission": "Assess contribution options against evidence and SOTA without overclaiming novelty.",
  "no_recursive_orchestration": true,
  "output_artifact_path": "runs/security-state-aware-mixed-platoon/phase12-formal-full-flow-runtime-test/candidate-artifacts/S03.candidate.json",
  "owner_gate_required": false,
  "packet_id": "phase10_s03_novelty_analysis_packet_v1.phase12_run",
  "return_format": {
    "candidate_artifact": "required",
    "evidence": "required",
    "missing_material_report": "required_if_blocked",
    "remaining_risks": "required"
  },
  "schema_version": "ppg-task-packet/v0.1",
  "stage_contract_ref": "examples/stage-contracts/S03.stage-contract.json",
  "stage_id": "S03",
  "status": "planned",
  "stop_condition": "S03 candidate artifact written to the run-owned Phase12 path only; return evidence without claiming graph, manuscript, submission, or publication completion.",
  "target_material": "phase10_s03_contribution_options",
  "task_kind": "novelty_analysis",
  "validators": [
    "validate_packet:phase10_stage_binding",
    "content_validator:S03",
    "stage_overlay:nature_expert_writing:S03"
  ],
  "worker_boot_clause": "completion_forbidden; no_recursive_orchestration; allowed_write_paths; MissingMaterialReport required when materials are missing; return candidate/evidence only."
}
